title,price
Guitarra eléctrica Cort X Series X100 de meranti black poro abierto con diapasón de jatoba,467.727
Guitarra acústica Cort Standard AF515CE para diestros natural open pore,356.318
Guitarra eléctrica Cort KX507 de caoba star dust green con diapasón de ébano,1.580.162
Guitarra Stratocaster Cort G110 Opsb Open Pore Sunburst,449.350
Guitarra eléctrica Cort X Series X100 de meranti black cherry poro abierto con diapasón de jatoba,467.727
Guitarra acústica Cort Standard AF510 para diestros black satin merbau,349.700
Guitarra eléctrica Cort G Series G260CS de aliso olympic white con diapasón de granadillo brasileño,1.099.793
Guitarra Cort Stratocaster G110 Opbc Open Pore Black Cherry,442.445
Guitarra acústica Cort Standard AD810 para diestros black satin,381.995
Guitarra eléctrica Cort X Series X100 de meranti black cherry burst poro abierto con diapasón de jatoba,467.727
Guitarra Cort X700Dii Pib Polar Ice Burst con Fishman y bolsa,2.654.673
Guitarra eléctrica Leonard LE362 stratocaster de aliso black con diapasón de palo de rosa,255.873
Guitarra eléctrica de 6 cuerdas Cort G110 Open Pore Strato Red Color,345.664
Guitarra Electroacústica Cort Standard AD880CE para diestros natural glossy,614.810
Guitarra eléctrica Cort CR Series CR200 de caoba gold top con diapasón de jatoba,862.140
Guitarra eléctrica Cort KX Series KX100 de tilo metallic ash con diapasón de jatoba,474.048
Guitarra Electroacústica Cort Standard AD880CE para diestros black,543.181
Guitarra eléctrica Cort KX Series KX100 stratocaster de tilo iron oxide con diapasón de jatoba,556.840
Guitarra eléctrica Cort KX Series KX307 Multi Scale de caoba 2018 open pore mahogany con diapasón de arce asado,1.036.586
Guitarra Acustica Cort Af510m Open Pore Tamaño Concierto Color Poro abierto Orientación de la mano Derecha,302.001
Guitarra acústica Cort Standard AD810 para diestros open pore,388.500
Guitarra Electrica Cort G110 Stratocaster Hss - Om Color Scarlet Red Material Del Diapasón Palo De Rosa Orientación De La Mano Diestro,428.851
Guitarra eléctrica Cort CR Series CR100 de caoba cherry red burst con diapasón de jatoba,589.296
Guitarra Electrica Cort G110 Strato Hss + Funda - Plus,462.705
Guitarra Electroacústica Cort AF510E Microfono Funda,403.662
Guitarra Electrica Cort Pink Pastel G200-ppk,493.801
Guitarra Acustica Cort Ad810op Funda De Color Natural Material Del Diapasón Wengué Orientación De La Mano Derecha,313.312
Guitarra acústica Cort Standard AF510 para diestros open pore merbau,349.808
Guitarra eléctrica Cort CR Series CR250 de caoba dark blue explosion con diapasón de jatoba,978.740
"Guitarra Super Strato Cort Floydrose Brown Burst, color negro, diapasón, material Jatobá, guía para la mano derecha",1.137.716
Guitarra Stratocaster Cort G110 Opsb Open Pore Sunburst,345.660
Guitarra acústica Cort L450CL-NS satin natural,935.456
Guitarra eléctrica Cort X700 Duality de caoba burst hielo polar con diapasón de ébano,2.515.618
Guitarra Electroacustica Cort Ad810 Eop Con Funda Cort Color Natural Orientación De La Mano Derecha,403.995
Guitarra eléctrica profesional Cort Strato G200 Skb Poplar color azul cielo,633.065
Guitarra eléctrica Cort G Series G250 de tilo champagne gold metallic con diapasón de jatoba,109.788
Guitarra Electroacustica Cort Sfx Me Eq Black Satin,524.713
Guitarra eléctrica Cort G Series G250 de tilo tobacco explosion con diapasón de jatoba,736.500
Guitarra Eléctrica Cort X300 Flip Blue,1.137.716
Guitarra Electrocriolla Cort Cec3 Ns Funda Corte  Plus,711.524
Guitarra Acustica Cort Earth 100 Dreadnought Caoba Tapa Stik,608.362
Guitarra eléctrica Cort G Series G250DX de tilo americano trans blue con diapasón de arce,577.999
Guitarra eléctrica Cort CR Series CR250 de caoba vintage explosion con diapasón de jatoba,1.174.500
Guitarra Acústica Cort Af510 M Op Brown Con Funda - Om,375.845
Guitarra eléctrica Cort X Series X700 Mutility de caoba black satin satin con diapasón de arce,2.515.618
Guitarra Cort Select G280 Color Ámbar,1.415.826
Guitarra Acústica Cort Af510 Tamaño Concierto + Funda,385.397
Guitarra eléctrica Cort CR Series CR100 de caoba black con diapasón de jatoba,589.246
Guitarra Cort X Series X100 De Meranti Black Poro Abierto,467.727
Guitarra acústica Cort Standard AD810 para diestros natural satin,360.308
Guitarra eléctrica Cort CR Series CR50 single-cutaway de arce black con diapasón de jatoba,458.354
Guitarra Matthew Bellamy Muse MBM-2p Starligth Silver Cort,1.618.086
Guitarra Electroacustica Cort Ad810 Eop Funda Acolchada,523.172
Guitarra eléctrica Cort KX Series KX307 Multi Scale de caoba 2018 open pore black con diapasón de arce asado,809.833
Guitarra Acustica Cort Af510 Bks Con Funda De Regalo,315.045
Guitarra Electroacustica Cort Ad810 E Bks - Funda - Plus,540.259
Guitarra Cort Vx2vwp Eléctrica,829.585
Guitarra acústica Cort Standard AD Mini M para diestros open pore,362.301
Guitarra eléctrica Cort G Series G260CS de aliso 3-tone sunburst con diapasón de granadillo brasileño,1.052.519
Guitarra Eléctrica Stratocaster Cort G110 Open Pore Material Del Diapasón Jatoba Orientación De La Mano Diestro Color Satin Black,442.444
Guitarra Electro Acustica Cort Ad810e-bks Con Funda Cort,437.414
Guitarra Eléctrica Cort G300 Pro Vivid Burgundy,1.435.972
Guitarra Cort Kx307 Zkx307ms-opm Multi Escala,1.036.586
Guitarra Electroacustica Cort Ad810e Satinada Natural,481.319
Cort X300 Fpu Serie X Guitarra Eléctrica Morado Tornasol Orientación De La Mano Diestro,888.841
Guitarra Electrica Cort Kx300 Opbc,1.008.774
Cort Ad810m Mahogany Guitarra Acustica Con Funda Orientación De La Mano Diestro,313.306
Guitarra Eléctrica Cort M Custom Bs,1.728.303
Guitarra Eléctrica Cort Kx Custom Bb,1.550.535
Guitarra Acustica Cort Ad810m-op Mahogany Open Pore,398.262
Guitarra Cort Kx508ms Mariana Blue Burst,2.199.586
Guitarra eléctrica Cort G Series G250 de tilo black con diapasón de jatoba,658.731
Guitarra Electroacústica Cort Standard AF510E para diestros open pore,403.662
Guitarra eléctrica para zurdo Cort G Series G250 de tilo black con diapasón de jatoba,754.125
Guitarra Electroacustica Cort Ad810e Negra Afinador + Funda,551.124
Guitarra Electrica Cort Kx300 Oprb ,788.106
Guitarra Eléctrica Cort X Series X100 De Meranti Black Cherr,467.727
Guitarra Acústica Cort Ad Mini Op 3/4 Viajera Con Funda. Color Natural Orientación de la mano Derecha,393.133
Guitarra eléctrica Cort G Series G260CS de aliso black con diapasón de granadillo brasileño,1.009.273
Guitarra Acústica Cort Ad Mini M Op Caoba ,315.045
Guitarra Electrica Cort Kx300 Burst Cobalto Open Pore,926.025
Guitarra Eléctrica Cort Kx Custom Bb,1.984.684
Guitarra eléctrica Cort Sunset Series Sunset II les paul de caoba black con diapasón de palo de rosa,1.261.601
Guitarra Electroacustica Cort Ad810e Op Poro Abierto Funda,418.545
Guitarra eléctrica Cort G Series G250 de tilo silver metallic con diapasón de jatoba,733.195
Guitarra Cort Kx500 Meneace X500 Grey Satin,1.669.047
Guitarra eléctrica Cort CR Series CR250 de caoba black transparent con diapasón de jatoba,978.740
Guitarra eléctrica Cort X Series X300 de tilo gray explosion con diapasón de arce,983.442
Guitarra Electrica Cort X100 Opbc Black Cherry,467.727
Guitarra Electrica Strato Cort G250 Con Push Pull - Oddity ,583.357
Guitarra Electrica Cort Kx300 Oprb,1.008.774
Guitarra Electroacústica Cort Standard AD880CE para diestros natural satin,469.999
Guitarra Eléctrica Stratocaster Cort G110 Open Pore Material,442.444
Guitarra Cort G110 Satin Black Cherry Open Pore,442.445
Guitarra Acustica Cort Earth 100 Ns Dreadnought Color Natural Material Del Diapasón Ovangkol Orientación De La Mano Derecha,744.436
Cort Jade1 Guitarra Acustica Media Caja Corte Funda Color Natural Poro Abierto Orientación de la mano Derecha,459.066
Guitarra Cort Kx508ms Mariana Blue Burst,1.718.427
Guitarra acústica Cort Standard AD880 para diestros natural satin,460.925
Guitarra Eléctrica Cort G250 Negra,572.809
Guitarra eléctrica Cort KX Series KX100 stratocaster de tilo metallic black barniz brillante con diapasón de jatoba,606.781
Guitarra Electrica Cort Kx300 Burst Cobalto Open Pore,831.452
Guitarra Stratocaster Cort G110 Opsb Open Pore Sunburst,442.445
Cort Ga Pf Bevel Guitarra Electro Acustica Lr Baggs Color Natural Material del diapasón Pau ferro Orientación de la mano Diestro,1.205.874
Guitarra Eléctrica Cort G250 Negra ,734.195
Guitarra Cort Elec Clásica Ac120 Ce Op,477.999
Guitarra eléctrica Cort X Series X300 de tilo brown explosion con diapasón de arce,1.044.389
Guitarra Cort Clásica Cec5 Natural,1.036.586
Guitarra Eléctrica Cort G250 Champagne Gold Metallic,733.195
Guitarra criolla clásica Cort Sunset Nylectric para diestros natural,1.089.918
Guitarra Eléctrica Cort Kx100 Metallic Ash - Plus,583.348
Guitarra eléctrica Cort CR Series CR200 de caoba black con diapasón de jatoba,862.140
Guitarra Elec Acústica Cort Ad 880 Ce Bk Negra,543.181
Guitarra Eléctrica Cort G200 Strato Humbucker - Oddity,506.180
Guitarra Cort Eléctrica X300-brb,1.137.716
Guitarra Cort Kx500 Etched Deep Violet,1.870.912
Guitarra Electrica Cort M Custom Tes Mics Seymour Duncan ,1.728.303
Guitarra Eléctrica Cort M Custom Bs,2.212.228
Guitarra Clásica Cort Jade E Nylon-brb Rojo Burgundy,483.924
Guitarra Eléctrica Cort G Custom Crs,1.461.650
Guitarra Eléctrica Cort G250 Silver Metallic,573.809
Guitarra Eléctrica Cort G250 Champagne Gold Metallic,572.809
Guitarra Criolla Cort Ac100 Op C/ Funda - Oddity,327.424
Guitarra Eléctrica Cort X Series X700 Mutility Black Satin,1.965.327
Guitarra Cort X700dii Duality Ii Lvb Lava Burst Con Fishman,2.073.964
Cort Ad880 Ns - Guitarra Acústica - Plus,488.853
Guitarra eléctrica Cort KX Series KX300 Etched de caoba black red engraved con diapasón de granadillo brasileño,1.183.641
Guitarra Electrocriolla Cort Cec5 Natural Glossy Cuota,1.023.415
Guitarra Eléctrica Cort G280 Select Tbk,1.106.114
 Guitarra Cort Eléctrica X700 Duality-lbb,2.515.618
Guitarra Cort Electroacústica Ad810e-op Con Funda,531.037
Guitarra G290fat Ii Tbb Trans Black Burst - Cort,1.516.956
Cort Earth70 Op - Guitarra Acústica  - Oddity,607.171
Guitarra Cort X700dii Duality Ii Lvb Lava Burst Con Fishman,2.654.673
Guitarra Clásica Cort Ac100 Sg Semi Gloss ,315.045
Guitarra Cort Matthew Bellamy Mbm-2h-sus-bbe Azul,2.009.966
Guitarra Cort Matthew Bellamy Mbm-2p-sblk,1.618.086
Guitarra Eléctrica Cort Kx Series Kx300 Etched Black Gold,1.289.412
Guitarra Clasica Criolla Cort Ac 100  ,315.045
Guitarra Cort Eléctrica Garage 1 C/funda ,1.352.619
Guitarra Acústica Cort Ad Mini Op Little 3/4 Funda - Oddity,324.186
Guitarra Electroacústica Cort Ad810e-bks Eq Funda,546.768
Guitarra Eléctrica Cort G Custom Crs ,1.870.912
Guitarra Eléctrica Cort Kx100 Iron Oxide + Funda - Plus,617.161
Guitarra Cort Eléctrica Aero Custom Bc,1.238.452
Guitarra Electrica Cort G260cs-3ts - Oddity,871.649
Guitarra Electrica Cort G110 Super Strat Prm,397.509
Guitarra Eléctricacort G260cs-3ts,859.213
Guitarra Clasica Cort Ac50 Open Pore Niño Con Funda - Plus,348.693
Guitarra Acústica Mini Cort Ad Mini M Caoba Con Funda,362.301
Guitarra Electrica Cort Kx100 Io ,474.048
Cort Mr600f-ns Guitarra Electroacustica Con Funda - Plus,923.854
Guitarra Eléctricacort G260cs-ow,859.213
Guitarra Clásica Cort Jade E Nylon-brb Rojo Burgundy,619.423
Guitarra Cort G200-skb Sky Blue,493.801
Guitarra Electrica Cort Sunset 2 Maple Caoba Humbuckers,1.007.193
Cort Ad810e Guitarra Electro Acustica Negra Satinada Funda,437.413
Guitarra Eléctrica Cort Kx300-oprb Emg Retroactivos Serie Kx,831.452
Guitarra Acústica Cort Earth 100 Natural Satin Cuerdas Acero Orientación De La Mano Derecha,608.362
Guitarra Cort Eléctrica Aero Custom Bc,1.590.172
Guitarra eléctrica Cort CR Series CR250 de caoba black transparent con diapasón de jatoba,1.174.500
Guitarra Electrica Cort Kx100 Io ,474.048
Guitarra Electroacustica Cort Mr710f + Funda Prm,965.381
Guitarra Clásica Electroacústica Cort Cec-3,575.771
Guitarra Electrica Cort G260cs-3ts - Plus,1.052.519
Guitarra Electrica Cort Sunset 2 Maple Caoba Humbuckers,1.007.193
Guitarra Eléctrica Cort Kx 500 Ebony,1.870.912
Guitarra Clásica Cort Ac100 Sg Semi Gloss ,400.472
Guitarra Eléctrica Cort Kx300-oprb Emg Retroactivos Serie Kx,831.452
Guitarra eléctrica Cort CR Series CR250 de caoba antique amber con diapasón de jatoba,978.740
Guitarra Acústica Cort Earth Pack Correa Funda Afinador Puas,375.288
Guitarra Cort Eléctrica Aero Custom Bc,1.590.172
Guitarra Electrica Les Paul Cort Cr250vb Std Vintage Brown,1.108.611
Guitarra Eléctrica Cort G200 Strato Humbucker - Plus,610.222
Guitarra Cort Clásica Ac 200 Op,549.613
Guitarra Eléctrica Cort Gene Simmons Gs-axe Negra,869.089
Guitarra Tarraxas Trava Cort G200 Black Stratocaster,632.065
Guitarra Cort Clásica Cec5 Natural,809.833
Guitarra Electrica Cort X300-brb Cuerpo Tilo Americano ,937.728
Guitarra Electrica Cort G110 Stratocaster Hss - Oddity,354.781
Guitarra Cort Eléctrica Sunset 2 Bk,1.261.601
Guitarra Criolla Clasica Cort Ac200 Natural ,432.364
Guitarra Eléctrica Zurda Cort G250 Lh Strato Black - Plus,754.125
Guitarra Eléctricacort G260cs-ow,859.213
Guitarra criolla clásica Cort Classic CEC1 brillante,367.089
Guitarra Electrica Cort Kx100-ma Ceniza Metalica,606.782
Guitarra Eléctrica Cort Kx100 Humbuckers Dobles Super St,500.121
Guitarra Acústica Cort Earth 100 Nat  Natural Funda - Oddity,614.073
Guitarra G290fat Ii Tbb Trans Black Burst - Cort,1.185.122
Cort Guitarra Electroacústica Serie Mr Natural Color Natural Satin,1.120.990
Guitarra Cort G-custom Articulo A Pedido Musicapilar,1.546.314
Guit Eléc Cort Cr250 Antique Amber - Les Paul / En Belgrano!,978.740
Guitarra Eléctrica Cort Kx Series Kx100 Iron Oxide - Oddity,481.766
Guitarra Acústica Cort Af510 Op Natural C/funda - Oddity,317.672
Guitarra Eléctrica Cort Kx Series Kx100 Iron Oxide - Plus,583.348
Guitarra Eléctrica Cort G260cs-bk Stratocaster En Caja,1.009.273
Guitarra Eléctrica Cort Kx100 Iron Oxide + Funda - Oddity,508.617
Guitarra Cort Eléctrica Garage 1 C/funda,1.056.734
Guitarra Cort Kx507ms 7 Cuerdas Star Dust Black,2.022.608
Guitarra Eléctrica Cort Kx100 Metallic Ash + Funda - Oddity,508.617
Guitarra Clasica Criolla Cort Ac 100,315.045
Guitarra Eléctrica Cort Kx100 Metallic Ash + Funda - Plus,617.161
Guitarra Electrica Cort Pink Pastel G200-ppk,632.065
Guitarra Acustica Cort Earth Mini Op Caja 3/4 Escala 22.8 Pr,474.739
Guitarra Eléctrica Cort Kx Series Kx300 Etched Black Gold,1.008.354
Guitarra Electrica Cort Kx300 Opbc,788.106
Guitarra eléctrica Cort CR Series CR200 de caoba inverted blue con diapasón de jatoba,862.140
Guitarra Cort Kx500 Meneace Bks Satin Black,1.669.047
 Guitarra Acústica Cort Af510 Black Satin Con Funda - Oddity,333.563
Guitarra Acústica Cort Af510 Black Satin Con Funda - Plus,396.045
Guitarra Eléctrica Cort Kx300-oprb Emg Retroactivos Kx Cuo,926.025
Guitarra Eléctrica Cort G300 Pro Vivid Burgundy,1.838.044
Guitarra Cort Eléctrica - Garage2 Matthias Jab Signature,1.215.244
Guitarra Cort Kx500 Meneace X500 Grey Satin,2.136.380
Guitarra Eléctrica Cort G250 Stratocaster Dorada Hss,572.809
Guitarra Clasica Cort Ac200 Op Con Funda - Oddity Color Marrón Material Del Diapasón Arce Orientación De La Mano Ambidiestro,537.397
Guitarra Eléctrica Cort Kx100 Metallic Ash - Oddity,481.766
Guitarra Electroacustica Cort Cec3 Color Natural Material Del Diapasón Ovangkol Orientación De La Mano Diestro,713.957
Guitarra Cort Kx500 Meneace Bks Satin Black,2.136.380
Guitarra Eléctrica Cort G Series G290 Fat Bright Blue Burst,1.516.956
Guitarra Eléctrica Cort G Series G290 Fat Bright Blue Burst ,1.186.122
Guitarra Electrocriolla Cort Cec5 Natural Glossy Afinador,898.915
Guitarra Cort Eléctrica Gasoline,760.453
Guitarra Cort Matthew Bellamy Mbm-2p-sblk,1.264.130
Guitarra Electrica Cort Kx100-ma Ceniza Metalica,474.048
Cort Ac200 Guitarra Criolla Tamaño 3/4 Tapa Solida,355.535
Guitarra Eléctricacort G260cs-bk ,810.579
Guitarra Electrocriolla Cort Cec5 Natural Con Eq /,931.308
Guitarra Cort Kx700 Evertune Opbk,2.654.673
Guitarra Electrica Strato Cort G250 Con Push Pull - Plus,706.101
Guitarra Criolla Mediana C/funda - Cort Ac70 Op - Oddity,299.031
Guitarra Eléctrica Cort G300 Pro Black,1.435.972
Guitarra Cort Clásica Ac 250 Natural,608.362
Guitarra Electrica Cort Cr250 Tbk Classic Rock Les Paul Bk,1.108.611
Guitarra Eléctrica Cort Kx100 Humbuckers Super St Cuot,557.007
Guitarra Cort Kx500 Etched Deep Violet,1.461.650
Guitarra Acustica Cort Earth 60 M Caoba Optb Funda - Oddity,395.743
Guitarra Cort Kx700 Evertune Opbk,2.073.964
Guitarra Cort Clásica Cec7 Natural,1.390.542
Guitarra Eléctrica Cort G250 Negra Hss Con Palanca,572.809
Guitarra Cort Kx700 Evertune Articulo A Pedido Musicapilar,2.190.378
Guitarra Eléctrica Stratocaster Cort G110 Open Pore,345.560
Guitarra Electrica Cort Sunset 2 Maple Caoba Humbuckers Prm,1.158.272
Guitarra Eléctrica Cort G250 Stratocaster Negra Con Tremolo,658.730
Guitarra Electro Acustica Con Afinador Y Funda Original Cort Ad810e Dreadnought,480.419
Guitarra Eléctrica Cort Garage2 Matthias Jab Signature,1.056.734
Guitarra Eléctrica Cort Kx Series Kx300 Etched Black Gold,1.008.354
Guitarra Criolla Clasica Cort Cec3 Ns Natural C/ Corte Y Eq ,662.136
Guitarra Acústica Cort Af510 M Op Brown Con Funda - Oddity,314.388
Guitarra Acústica Cort Earth 100 Negra Con Funda Tapa Sólida,608.362
Guitarra Criolla Mediana Con Funda - Cort Ac70 Op  Plus,368.547
Guitarra Electrica Cort Sunset 2 Maple Caoba Humbuckers Color Negro Material Del Diapasón Palo De Rosa Orientación De La Mano Diestro,1.007.193
Guitarra Criolla Cort Ac200 Nat Tapa Abeto Funda - Oddity,444.747
Guitarra Cort G280 Select Musicapilar - Art A Pedido,1.116.661
Guitarra Electrica Cort Tipo Prs Gasoline Musicapilar,772.667
Guitarra Electro Acustica Cort Ad810e Bks Negra + Funda,437.400
Guitarra Cort Earth Mini Op,528.405
Guitarra Clasica Cort Ac200 Op Con Funda - Oddity,445.862
Guitarra Cort Kx500 Etched Edv Articulo A Pedido Musicapilar,1.547.979
Guitarra Eléctrica Cort Kx300 Oprb  Musicapilar,802.415
Guitarra Electrica Cort G110 Stratocaster Hss - Om,428.851
Cort Ga-medx-op Guit Electroacustica Corte Tapa Solida Funda,424.373
Guitarra Eléctrica Cort X700 Duality Ii Lvb - Musicapilar,2.086.178
Guitarra acústica Cort AC250 para diestros natural ovangkol brillante,125.183
Guitarra Electrica Cort Aero Custom - Musicapilar,1.426.667
Cort Mr710f Guitarra Electro Acustica Fishman Corte Funda,839.460
Guitarra Electrica Cort Sunset 2 Maple Caoba Humbuckers Prm,1.158.271
Guitarra Cort G300pro-bk Musicapilar - Art A Pedido,1.411.312
Guitarra Eléctrica Cort Gene Simmons Gs-axe Negra,1.112.433
Guitarra Cort Kx507ms 7 Cuerdas Star Dust Black,1.580.163
Guit Electrica Cort Gsguitaraxe - Musicapilar Art A Pedido,1.003.326
Guitarra Acústica Cort Earth 100 Bk Negra Tapa Sólida Funda,699.617
Guitarra Cort Electroacústica Af590mf Op,493.801
Guitarra Acústica Cort Ad 880 Ns C/funda,392.394
Guitarra Acustica Mediana Cort Earth Mini C/funda - Oddity,423.367
Guitarra acústica Cort Earth 50 para diestros satin,548.213
Guitarra Eléctrica Cort G300pro Vvb  - Musicapilar,1.448.180
Guitarra Eléctrica Cort G290fat Ii Tbb  Musicapilar,1.197.327
Guitarra Eléctrica Cort G260cs Ow  Musicapilar,859.222
Guitarra Eléctrica Cort G290 Fat Ii Avb  Musicapilar,1.240.994
Guitarra Acustica Cort Earth Mini De Tapa Solida,511.894
Guitarra Cort G290fat Ii Bbb Articulo A Pedido Musicapilar,1.274.505
Guitarra Eléctrica Cort Kx300 Opcb  Musicapilar,798.650
Guitarra Acustica Cort Af510 Bks Negro Con Funda De Regalo,362.301
Guitarra Eléctrica Cort Mbm-2p - Musicapilar,1.274.679
Guitarra Eléctrica Cort X700 Duality Lbb - Musicapilar,1.977.540
Guitarra Eléctrica Cort X500 Menace Bks - Musicapilar,1.669.065
Guitarra Eléctrica Cort Mcustom Bs - Musicapilar,1.738.857
Guitarra Clásica Electroacústica Cort Cec-3 Ns,736.987
Guitarra Eléctrica Cort G280 Select Tbk - Musicapilar,1.118.318
Guitarra Cort Mbm-2h-sus-bbe Articulo A Pedido Musicapilar,1.666.013
Cort G260cs-3ts Cort Guit.elec.g260cs 3ts,871.414
Guitarra Eléctrica Cort X700 Duality Ii Pib - Musicapilar,2.086.178
Guit Eléc Cort Kx300 Etched Ebg Musicapilar Art A Pedido,1.017.900
Guitarra Eléctrica Cort X700 Mutility Bks - Musicapilar,1.977.540
Guitarra Eléctrica Cort G260cs-bk  Musicapilar,871.414
Guitarra Eléctrica Cort Guitarra Garage2  Musicapilar,1.219.430
Guitarra Cort Kx300 Etched Ebr Articulo A Pedido Musicapilar,1.073.890
Guitarra Eléctrica Cort Garage1  Musicapilar,1.217.321
Guitarra Electrica Cort G250 Super Strat ,572.809
Guitarra Electroacústica Cort Ad810e-op Con Funda Cort,463.381
Guitarra Eléctrica Cort G290 Fat Antique Violin Burst,1.185.122
Guitarra Electroacústica Cort Ad810e-op Con Funda Cort,463.381
Guitarra Acustica Cort Earth 60 M Caoba Optb Funda - Plus,478.284
"Guitarra electroacústica natural Cort Cec1op Nylon Auditorium, orientada a la derecha",540.159
Guitarra Electroacustica  Cort Ad 810 E Con Funda- Natural,418.550
Guitarra Cort Electroacústica Jade Class Pastel Pink Op,581.499
Cort Ad810e Guitarra Electro Acustica C/ Funda,418.537
Guitarra Cort Elec Clásica Ac 160 Cf Natural,619.226
Guitarra Acústica Cort Ad 810 Op,313.306
Guitarra Cort Elec Acustica Sfx 1f Ns,973.379
Guitarra Cort Acustica L300 Vf Nat,1.106.114
Guitarra Cort Electroacustica Sfx Ash Burl Sfx-ab-op Black,632.065
Guitarra Cort Elec Clásica Ac120 Ce Op,607.611
Guitarra Cort Clásica Ac70 Op,293.317
Guitarra Acustica Cort Earth 60 M Optb,385.164
Guitarra Cort Electroacústica Jade Class Sky Blue Open Pore,454.296
Guitarra Cort Electroacustica Sfx Ash Burl Sfx-ab-op Black,493.801
Guitarra Acustica Cort Ad-810 Ssb,313.306
Cort Guitarra Electroacústica Baritona Ndx,1.511.899
Guitarra Cort Electroacústica Ad810e-op Con Funda,418.545
Guitarra Acústica Cort Earth Pack Correa Funda Afinador Puas,480.368
Guitarra Acústica Cort Ad 810 Op,398.262
Guitarra  Acustica Cort Af510m-op ,386.571
Cort Guitarra Electroacustica Ga-my Bevel-nat,1.542.238
Guitarra Clásica Cort Ac 50 Niño Op,282.454
Cort Guitarra Electroacustica Ga5f-bw-ns,948.097
Cort Guitarra Electroacustica Ga-my Bevel-nat ,1.204.874
Cort Guitarra Electroacústica Mr730fx-nat,1.643.368
Guitarra Cort Clásica Ac100 Op,315.045
Cort Guitarra Electroacústica Ndx20-nat,1.181.171
Cort Guitarra Electroacustica Ga-pf Bevel-nat,1.205.874
Guitarra Cort Clásica Ac 200 Natural ,549.613
Guitarra Electroacústica Cort Ga-ff-nat ,599.296
Guitarra Electroacústica Cort Ga-qf-cbb ,599.296
Guitarra Electroacústica Cort Ga-qf-cbb,767.098
Guitarra Electroacústica Cort Ga-qf-tbb,767.098
Cort Guitarra Electroacustica Af510e-bks,423.681
Guitarra Acustica Cort Admini-op Con Funda,333.947
Guitarra Acústica Cort Earth 100 Natural,608.362
Guitarra Cort Clásica Ac 200 Natural,432.372
Guitarra Cort Elec Acustica Sfx 1f Ns,760.453
Guitarra Electroacústica Cort  Standard Ad880ce  Satin,523.416
Guitarra Cort Clásica Ac 200 Op,432.372
Guitarra Acústica Cort Ad 880 Ns C/funda,498.795
Guitarra Clásica Cort Ac 50 Niño Op,359.044
Guitarra Cort Ndx 50 Natural Elec Acústica,1.343.138
Guitarra Acústica Cort  Standard Af510  Open Pore,304.181
Guitarra Electroacústica Cort  Standard Ad880ce,666.616
Guitarra  Acustica Cort Af510-bks,315.045
Guitarra  Acustica Cort Af510-bks,405.516
Guitarra Acústica Cort  Standard Af510  Open Pore,390.567
Guitarra Cort Electroacústica Af590mf Op,634.040
Guitarra Cort Clásica Ac70 Op,393.740
Guitarra Electroacústica Cort Ga-medx-op,399.550
Cort Guitarra Electroacustica Af510e-bks,576.645
Cort Guitarra Electroacustica Ga-pf Bevel-nat,1.634.772
Guitarra Acústica Cort Standard Af510e,537.411
Guitarra Acustica Cort Earth 60 Op Open Pore,493.010
Guitarra Acústica Cort Ad810 Bks Negra,422.239
Guitarra Acustica Cort Ad-810 Ssb,398.262
Guitarra Electroacústica Cort Ga-ff-nat,767.098
Guitarra Electroacústica Cort Ga-medx-op Na,511.424
Cort Guitarra Electroacustica Ad810e-bks,556.015
Cort Guitarra Electroacustica Ad810e-bks,437.408
Cort Guitarra Electroacústica Mr710f-ns,839.461
Guitarra Acústica Cort Standard Af510e,418.545
Guitarra acústica Cort Grand Regal GA5F,1.213.564
Guitarra Cort Clásica Ac100dx-op,315.045
Guitarra Acústica Cort Earth 100 Natural,778.703
Guitarra Cort Clásica Ac100 Op,400.472
Guitarra Acústica Cort Ad810 Bks Negra,331.170
Guitarra Cort Acustica  Jade1-op,472.783
Cort Guitarra Electroacustica L450cl-ns,967.849
Guitarra Acústica Concierto Cort L100c Color Natural Material del diapasón Caoba,619.661
"Funda, afinador, lengüeta y correa de guitarra Cort Cap810 Op, material para dedos, color natural, guía para la mano derecha",429.803
Guitarra Acústica Cort Earth 100 Ns,733.626
Guitarra Cort Clásica Ac100dx-op,400.472
Guitarra Acustica Cort Admini-op Con Funda,403.257
Guitarra Cort Acustica  Luce Bevel Cut-op,632.065
Guitarra Electroclásica Cort Cec5-nat En Caja,951.269
Guitarra Acustica Cort Earth Mini C7funda  Plus,511.827
Guitarra Electro Acústica Cort Con Funda Cort Af510e-bks,444.865
Guitarra Electroacustica Cort Ad810e-op Eq Afinador + Funda,418.500
Cort Af510e Guitarra Electro Acustica Cuerpo Concierto Funda,418.537
Cort Cm15r Amplificador Combo Guitarra 15 Watts Vintage,193.568
Cort Mr500e Guitarra Electro Acustica Dread Corte Pre Amp,691.320
Cort Ad880-ns Guitarra Acustica Dreadnought C/ Funda,434.464
Cort Af510 Bks Guitarra Acustica - Grey Music -,348.822
Cort Af510e-bks Guitarra Electroacustica Folk Con Funda,469.106
Guitarra Electroacustica Cort Af510e-op C/ Funda Cort,463.420
Guitarra Acustica Cort Ad810 Bks Negro Satin Con Funda Cort,367.783
Guitarra Acustica Cort Ad-810 Op Con Funda - Grey Music -,346.881
Guitarra Acústica Cort Af-510 Op Con Funda,304.181
Cort Guitarra Electroacústica Folk Natural Color Brillante Natural,1.415.826
Guitarra Acústica Cort Earth Mini Op 3/4 Viajera Con Funda,412.817
Guitarra Criolla Clásica Cort Cec5 Nat Slim Fishman + Funda.,1.068.990
