title,price
Guitarra Criolla Clásica Cort Cec5 Nat Slim Fishman + Funda,809.833
Guitarra Criolla Clásica Cort Cec3 Ns Slim Corte Eq + Funda,575.771
Guitarra Criolla Clásica Cort Cec3 Ns Slim Eq Con Funda.,764.990
Guitarra Acústica Cort Earth-70 Nat Natural Con Funda.,998.794
Guitarra Criolla Clasica Cort Cec3 Ns Eq Electroacustica,575.771
Guitarra Electro Acustica Cort Ad810e-bks Con Funda Cort,503.026
Guitarra Electro Acustica Cort Ad810e-bks Y Funda,546.768
Guitarra Electroclasica Cort Ac120 Ce Op Funda - Oddity,485.673
Guitarra Electro Acústica Con Funda Cort Af510e-op,439.465
Guitarra Criolla Clasica Cort Cec3 Ns Natural C/ Corte Y Eq ,662.137
Cort Guitarra Electroacustica Ga5f-bw-ns,1.213.564
Guitarra Electroacustica Cort Ad810e Negra Afinador + Funda,437.400
Guitarra Acustica Cort Ad810 Ssb,313.307
Guitarra Electroclásica Cort Ac160 Cf Fishman Funda - Oddity,631.599
Guitarra Clasica Cort Ac50 Open Pore Niño Con Funda - Oddity,290.130
Cort Sfx-dao Guitarra Electroacustica Con Funda - Oddity,523.002
Guitarra Electroclásica Cort Ac160 Cf Fishman Funda - Plus,765.404
Cort Sfx E Ns Satinada Abeto Electroacústica - Oddity,644.485
Cort Ad880 Ns - Guitarra Acústica - Oddity,404.769
Guitarra Acustica Cort Ad810 Black  Con Funda  Oddity,344.571
Guitarra Acústica Cort Jade 1 Con Funda Y Corte - Oddity,381.742
Guitarra Acústica Cort Earth 70 Brown - Oddity,601.028
Cort Ad880ce Nat - Natural Electroacústica C/funda - Plus,647.339
Guitarra Acustica Cort Earth60 Con Funda - Oddity,397.569
Guitarra Acústica Cort Luce L450c Concierto Caoba - Oddity,744.319
Guitarra Electroacústica Cort Af510e Op C/funda - Oddity,429.095
Cort Sfx E Ns Satinada Abeto Electroacústica - Plus,779.937
Cort Ad880ce Nat - Natural Electroacústica C/funda - Oddity,536.790
Guitarra Electroacústica Cort Af510e Op C/funda - Plus,515.908
Cort Earth70 Op  Guitarra Acústica   Plus,728.282
Cort Ac120 Ce Guitarra Electro Criolla Corte Y Pre Amp,477.998
Guitarra Acústica Cort Luce Bevel Vintage Satin Oddity,644.485
Guitarra Acustica Cort Earth 100 Ns Dreadnought - Oddity,614.073
Guitarra Acustica Cort Ad810 - Black - C/funda - Plus,415.755
Guitarra Electro Acústica Cort Af510e Con Funda - Plus,526.883
Guitarra Acústica Cort Earth 70 Brown - Plus,725.342
Guitarra Criolla Cort Ac100 Op C/ Funda - Plus,394.934
Guitarra Electroacústica Cort Af510e-bks  - Oddity,436.088
Pack Guitarra Acústica Tapa Maciza Cort Earth - Plus,466.314
Guitarra Clasica Cort Ac200 Op Con Funda - Plus,537.397
Guitarra Acústica Cort Luce Bevel Vintage Satin - Plus,781.052
Guitarra Acústica Cort Luce L450c Concierto Caoba - Plus,900.925
Guitarra Acústica Cort Jade 1 Con Funda Y Corte - Plus,459.066
Guitarra Acústica Cort Earth Bevel Cut Con Funda - Oddity Color Marrón Material Del Diapasón Palo Rosa Orientación De La Mano Diestro,670.124
Guitarra Criolla Tapa Solida Cedro Cort Ac250 Funda - Oddity,620.736
Pack Guitarra Acústica Tapa Maciza Cort Earth - Oddity,390.132
Guitarra Criolla Clasica Cort Ecec7 Electroacustica  Eq,1.086.362
Cort Sfx Me Guitarra Electro Acustica Media Caja Corte Negra,456.271
Guitarra Electroacustica Cort Sfx Me Eq Prm,524.713
Guitarra Electroacustica Cort Gaqf Grand Auditorium Prm,689.182
Guitarra Criolla Clasica Cort Ac200 Natural - Prm,497.219
Guitarra Electroacustica Cort Sfx Me Eq Prm,494.734
Guitarra Acústica Cort Ad Mini Op Little 3/4 Funda - Plus,391.700
Guitarra Clasica Criolla Cort Ac 100 Prm,362.302
Guitarra Electroacustica Cort Mr730fx Natural Con Funda Prm,1.476.465
Guitarra Electroacustica Cort Mr730fx Natural Con Funda,1.283.882
Guitarra Criolla Clásica Cort Cec7 Nat Slim Cort Eq + Funda,1.086.362
Guitarra Electrocriolla Cort Cec5 Natural Con Equalizador,809.833
Guitarra Acústica Cort Earth 100 Rosewood Tapa Sólida,712.620
Guitarra Acústica Cort Earth 70 Natural,540.568
Guitarra Acustica Cort Earth Mini Op Caja 3/4 Escala 22.8 Pr,474.740
Guitarra Criolla Clásica Cort Cec7 Nat Slim Cort Eq + Funda.,1.429.990
Guitarra Acústica Cort Luce Bevel Cut Cuerpo Vintage Satin Color Marrón claro Material del diapasón Ovangkol Orientación de la mano Derecha,632.065
Guitarra Clasica Cort Ac200 Op Con Funda - Oddity,445.862
Guitarra Electro Acústica Con Funda Cort Af510e-op Cuo,598.509
Guitarra Acustica Cort Pack Correa Puas Funda Afi Cap-810-op,429.803
Cort Af510e Guitarra Electro Acustica Negra Media Caja Funda,423.680
Guitarra Electro Acústica Fishman Con Funda Cort Ga-qf-tbb C,856.981
Guitarra Electroacústica Cort Ad810e-op Con Funda,439.465
Guitarra Electro Acústica Fishman Con Funda Cort Ga-qf-tbb,629.252
Guitarra Acústica Con Funda Cort Af510m-op,317.101
Guitarra Electroacústica Cort Ad810e-op Con Funda Cuo,598.509
Guitarra Electro Acústica Cort Con Funda Cort Af510e-bks Cuo,605.864
Guitarra Acústica Con Funda Cort Af510m-op Cuo,431.861
Guitarra Acustica Cort Af510 Bks Y Funda,393.806
Guitarra Acustica Cort Ad810 Bks Con Funda Cort,332.169
Guitarra Acustica Cort Ad-810 Bks Negro  Con Funda Cort ,381.995
Guitarra Acustica Cort Ad810 Bks Con Funda Acolchada ,415.212
Guitarra Acustica Cort Ad810 Satinada Porosa Con Funda,360.308
Guitarra Clásica Cort Ac150 Ns +funda Criolla Satinada,465.798
Guit Criolla Cort Ac150-nat Con Funda /,465.798
Guitarra Acústica Cort Earth Bevel Cut Satinada Tapa Sólida,543.181
Guitarra Acústica Cort Earth Bevel Cut Caja Dreadnought,624.658
Guitarra Criolla Cort Ac150-nat Con Funda,405.041
Guitarra Acústica Cort Luce Bevel Cut Corte Apoyabrazos,726.875
Guitarra Acústica Cort Earth-grand Tapa Sólida Satinada,540.568
"Guitarra eléctrica de concierto Cort AF590mf, cuerpo de caoba, orientación a la derecha",493.800
Guitarra Acústica Cort Ad810 Op Sunburst,330.544
Guitarra Acústica Cort L100c-ns,638.649
Guitarra Acustica Cort Ad810 Op Cuerdas Acero + Funda,330.544
Guitarra Acústica Cort Ad810 Op Cuerdas Acero Con Funda Cuo,368.141
Guitarra Criolla Tapa Solida Cedro Cort Ac250 Funda - Plus,752.213
Guitarra Acústica Cort Af510 Tamaño Concierto + Funda,320.911
Guitarra Acústica Cort Ad810 Op Sunburst En Cuot,368.141
Guitarra Acústica Cort Serie Earth 100 Dreadnought Cuo,714.826
Guitarra Acústica Cort Serie Earth 100 Dreadnought Con Funda,641.822
Guitarra Acústica Cort Serie Earth 100 Dreadnought Con Funda,770.795
Guitarra Acústica Cort Ad810 Op Sunburst,396.966
Guitarra Electroacústica Cort Ad810e Afinador/funda Bk Cuo,535.064
Guitarra Acústica Cort Af510 Concierto + Funda Cuo,357.413
Guitarra Acustica Mini Para Chico Y Adulto Cort Earthminio,412.817
Guitarra Acústica Cort Earth 100 Nat Natural Funda  Plus,744.436
Guitarra electro acústica Cort SFX-AB para diestros open pore natural,632.065
Guitarra Acustica Cort Earth Mini Tapa Solida,412.818
Guitarra Acústica Cort Earth Bevel Cut Con Funda - Plus,670.124
Cort Guitarra Electroacustica L450cl-ns,1.238.847
Guitarra Electroclásica Cort Ac160 Cf Fishman Funda - Plus Color Natural Material Del Diapasón Merbau Orientación De La Mano Diestro,762.463
Guitarra Cort Electroacustica Sfx Ash Burl Sfx-ab-op,632.065
Guitarra Electroclasica Cort Cec3 Ns Funda Corte - Oddity,588.145
Cort Guitarra Electroacústica Mr710f-ns,1.074.510
Guitarra Cort Electroacústica Jade Class Pastel Pink Op,454.296
Guitarra Electro Acustica De Viaje Cort Af510e + Funda,441.557
Guitarra  Acustica Cort Af510m-op ,302.008
Guitarra Clásica Criolla Cort Ac150-ns Con Funda Color Natural Orientación De La Mano Derecha,405.041
Guitarra Acustica Cort Earth 60 Op Open Pore,385.164
Guitarra Cort Acustica  Luce Bevel Cut-op,809.042
Guitarra Electroacustica Cort Af590mf-op Eq Fishman + Funda,493.800
Guitarra Elec Acústica Cort Ad 880 Ce Bk Negra ,690.469
Guitarra Acústica De Viaje Cort Ad Mini Color Caoba + Funda ,315.045
Guitarra Clásica Cort Jade E Nylon-dbb Marron Oscuro,483.924
Guitarra Acustica Cort Jade 1 Natural Open Pore Prm,424.767
Guitarra Electroacustica Cort Sfx Me Eq ,430.203
Guitarra Electroacustica Cort Sfx Me Eq Black Satin,456.272
Guitarra Criolla Clasica Cort Ac200 Natural - Envios,432.364
Guitarra Electroacustica Cort Mr710f + Funda Prm,965.380
Guitarra Criolla Clasica Cort Cec7 Natural C/ Corte Y Eq,1.086.362
Guitarra Electroacustica Cort Gaqf Grand Auditorium Prm,689.181
Guitarra Acustica Cort Earth-60 Prm,442.938
Guitarra Acustica Cort Earth 100 Dreadnought Caoba Tapa Stik,699.616
Guitarra Criolla Clasica Cort Cec7 Natural C/ Corte Y Eq Prm,1.249.316
Guitarra Electrocacústica Cort Mr710f Natural,1.074.510
Guitarra Acústica Cort Ad Mini Op 3/4 Viajera Con Funda,315.045
Guitarra Electro Acústica Cort Sfx-e-3tss Con Corte Y Eq,632.065
Guitarra Electro Acústica Cort Ad810e Bks Negro Con Funda ,437.414
Guitarra Electro Acústica Cort Sfx-e-3tss Con Corte Y Eq.,838.990
Guitarra Acústica Cort Earth-70 Br Brown Con Funda.,998.794
Guitarra Acústica Cort Earth-100 Nat Natural Con Funda.,812.990
Guitarra Electro Acústica Cort Ad810e Op Eq Con Funda. ,549.990
Guitarra Acústica Cort Ad810 Bks Negra Con Funda Original,332.169
Guitarra Electroacústica Cort Mr710f Ns Eq Fishman Con Funda,839.461
Guitarra Acústica Cort Af510 Op Open Pore Con Funda Orig,304.181
Guitarra Electro Acústica Cort Ad810e Op Eq + Funda Original,418.538
Guitarra Acústica Cort Earth-70 Br Brown Con Funda.,998.794
Guitarra Acústica Cort Earth-100 Nat Natural Con Funda.,812.990
Guitarra Electro Acústica Cort Ad810e Op Eq Con Funda. ,549.990
Guitarra Acústica Cort Ad810 Bks Negra Con Funda Original,332.169
Guitarra Electroacústica Cort Mr710f Ns Eq Fishman Con Funda,839.461
Guitarra Acústica Cort Af510 Op Open Pore Con Funda Orig,304.181
Guitarra Electro Acústica Cort Sfx-e-ns Con Corte Y Eq,632.065
Guitarra Electro Acústica Cort Ad810e Op Eq + Funda Original,418.538
Guitarra Acústica Cort Earth-70 Op Open Pore Con Funda Orig,768.610
Guitarra Electro Acústica Cort Mr710f Ns Fishman Con Funda.,1.120.990
Guitarra Acústica Cort Earth-100 Sb Sunburst Con Funda.,997.990
Guitarra Acústica Cort Ad Mini Op 3/4 Viajera Con Funda.,423.990
Guitarra Electro Acústica Cort Sfx-e-ns Con Corte Y Eq.,838.990
Guitarra Electro Acústica Cort Ad810e Bks Negro Con Funda.,584.990
Guitarra Acústica Cort Ad810 Ssb Sunburst Con Funda.,423.990
Guitarra Electroacustica Cort Af590mf-op Eq Fishman + Funda,622.188
Guitarra Acústica Cort Earth-70 Nat Natural Con Funda Orig,768.610
Guitarra Acústica Cort Earth-100 Ns Satin Con Funda Original,608.362
Guitarra Acústica Cort Earth-100 Bk Negra Con Funda Original,608.362
Guitarra Acústica Cort Earth-100 Bk Negra Con Funda.,812.990
Guitarra Acústica Cort Earth-70 Op Open Pore Con Funda.,998.794
Guitarra Acústica Cort Ad810 Bks Negra Con Funda Original.,449.990
Guitarra Acústica Cort Ad810 Ssb Sunburst Con Funda Original,313.312
Guitarra Acústica Cort Ad810 Op Open Pore Con Funda.,423.990
Guitarra Acústica Cort Af510 Bks Negra Con Funda Original ,315.045
Guitarra Acústica Cort Af510 Bks Negra Con Funda Original.,428.990
Guitarra Acústica Cort Af510 Op Open Pore Con Funda.,417.990
Guitarra Acustica Zurda Cort Ad810lh Op,335.784
Guitarra Acústica Cort Ad810 Op Open Pore Con Funda Original,313.312
Guitarra Acústica Cort Earth-70 Br Brown Con Funda Original,768.610
Guitarra Acústica Cort Earth-100 Ns Satin Con Funda.,812.990
Guitarra acústica Cort Earth-Grand para diestros open pore open pore,540.568
Guitarra Cort Elec Clásica Ac 160 Cf Natural,787.134
Guitarra Acústica Cort Ad810m-op Caoba + Funda,360.308
Guit Acústica Cort Af-510 Op Con Funda,349.808
Guitarra Electroacustica Cort Sfx Me Eq Natural Open Pore,494.734
Guitarra Acustica Cort Earth Mini Op Caja 3/4 Escala 22.8,412.817
Cort Sfx-dao Guitarra Electroacustica Con Funda - Plus,627.721
Cort Mr600f-ns Guitarra Electroacustica Con Funda - Oddity,763.005
Guitarra Acustica Cort Jade 1 Natural Open Pore Prm,424.768
Guitarra Electroacustica Cort Mr710f Con Funda,839.461
Guitarra Electroacustica Cort Ad810e Op Funda,518.996
Guitarra Electroacustica Cort Sfx E,632.065
Guitarra Electroacustica Folk Cort Ad810e Op + Funda ,418.500
Guitarra Acústica Cort Ad880 Ns Natural Satinada Palermo,437.409
Guitarra Acústica Cort Af-510 Op Con Funda De Regalo,380.226
Guitarra Electro Acústica Cort Ad880ce Nat Funda,614.810
Guitarra Electroacustica Cort Af510e Con Funda,520.297
Guitarra Acustica Cort Ad810 Dreadnought,388.500
Guitarra Criolla Clasica Cort Cec7 Natural C/ Corte Y Eq Prm,1.249.317
Guitarra Acustica Cort Jade 1 Natural Open Pore,369.363
Guitarra Electroacustica Cort Ad810e Op Con Funda ! Fm,418.545
Guitarra Electroacústica Cort Ga-qf-tbb ,599.296
Cort Guitarra Acústica Natural Color Natural Satin EARTH100-NAT,608.362
Guitarra acústica Cort MR730FX para diestros natural glossy,246.077
Guitarra Electroacustica Cort Ad810 Eop Con Funda Cort,418.538
Guitarra Electro Acústica De Viaje Cort Af510e Funda Cuo,491.782
Guitarra Acustica Cort Earth-60,385.164
Guitarra Acustica Cort Earth70nat Natural,470.059
Guitarra Acustica Cort Earth60 Con Funda - Plus,480.109
Guitarra Acustica Cort Earth-60 Prm,442.939
Guitarra Acústica Cort Ad810m-op Con Funda De Color Open Pore Orientación De La Mano Diestro,313.312
Guitarra Para Diestro Folk Acústica Cort Earth 100SB Sunburst,767.457
Guitarra Acustica Cort Af510m Tamaño Concierto Open Pore,347.301
Guitarra Acustica Cort Ga-my Bevel-nat Musica Pilar,1.281.652
Guitarra acústica Cort Standard AD810 para diestros satin sunburst,368.031
Guitarra Acústica Cort Earth 100rw Natural Tapa Sólida,819.513
Guitarra Electroacústica Cort Cec1 Op Nylon Con Corte Y Eq,389.115
Guitarra Acústica Cort Af510m Op Caoba Poro Abierto Material del diapasón Merbau Orientación de la mano Derecha,374.491
Guitarra Acústica Mini De Viaje Cort Earth Mini Open Pore,474.740
